2078659,11651644,"Kia America, Inc.",KIA,FORTE,2011,N,20250315,N,0,0,UNKNOWN OR OTHER,Kearny,NJ,KNAFT4A22B5,20250330,20250330,,,While driving on my home the car started accelerating on its own.Good thing I was already close to my house. ,IVOQ,N,,N,N,N,,,,,,,,,,,,,,,,,,,,V,,N,N,,,C_unknown_no_sibling
1921909,11540505,"Kia America, Inc.",KIA,SOUL,2014,N,20230808,N,0,0,UNKNOWN OR OTHER,Luverne ,MN,KNDJN2A22E7,20230824,20230824,,,Car knocks bad. Air has never worked well. Car had been stolen before.  Insurance did not do anything. My insurance has gone up because of the security system scandal. ,IVOQ,N,,N,N,N,,,,,,0,,,,,,,,,,,,,,V,,N,N,,,C_unknown_no_sibling
2026939,11616008,"Kia America, Inc.",KIA,EV9,2024,N,20240923,N,0,0,UNKNOWN OR OTHER,Seattle,WA,KNDADFS52R6,20240923,20240923,,,"The control screen with speedometer, all the advanced driving systems has blanked twice. The car still drives fine,  but I couldn’t  tell how fast I was going or access any of the advanced driving features or warnings using a camera. I wasn’t even sure if my turn signal was going until I got out and checked. All the online forums advise to turn off and lock car for 30 minutes and restart, which has worked, but the first time it happened I was driving downtown and couldn’t tell whether any of my external signals were working. The second time (several weeks later)  driving carpool. Get out and wait 30 minutes is not feasible.  Because they were spaced rather far apart, I don’t feel like it’s a single software update issue.  ",IVOQ,N,,N,N,N,,,,,,,,,,,,,,,,,,,,V,,N,N,,,C_unknown_no_sibling
1966210,11571085,"Kia America, Inc.",KIA,FORTE,2018,N,20220718,N,0,0,UNKNOWN OR OTHER,Kansas City ,MO,3KPFK4A77JE,20240209,20240209,,,Trunk opens unexpectedly ,IVOQ,N,,N,N,N,,,,,,0,,,,,,,,,,,,,,V,,N,N,,,C_unknown_no_sibling
2136061,11691126,"Kia America, Inc.",KIA,OPTIMA,2020,N,20250903,N,0,0,UNKNOWN OR OTHER,Franklin Park,NJ,5XXGW4L29LG,20251003,20251003,,,The turbo system on the car burns oil at a rapid rate. Had to pay $4000 to replace and still continues to give me problems and check engine light. Violates lemon law. Had replaced in September but was giving me problems well before and finally took it to the dealer for repair ,IVOQ,N,,N,N,N,,,,,,,,,,,,,,,,,,,,V,,N,N,,,RANDOM
2169816,11713252,"Kia America, Inc.",KIA,OPTIMA,2019,N,20260113,N,0,0,UNKNOWN OR OTHER,Sacramento,CA,5XXGU4L13KG,20260125,20260125,,,The paint is bubbling and falling off in spots. This is ruining our trade-in value. The dealer says it always happens to white vehicles. ,IVOQ,N,,N,N,N,,,,,,35,,,,,,,,,,,,,,V,,N,N,,,RANDOM
1910150,11532470,Hyundai Motor America,HYUNDAI,IONIQ 5,2022,N,20221210,N,0,0,ELECTRICAL SYSTEM,Bentonville,AR,KM8KM4AE2NU,20230715,20230715,,,"1.We purchased the vehicle (Hyundai Ioniq 5, 2022 Model) on MAY 20, 2022. 2.The vehicle was acceptable until it started to fail on us while we were on the road, and soon after the vehicle crawled home at limited power and came to a stop, it would no longer even turn on. 3.Then started our nightmare with Hyundai USA. We called the service department and they told us, based on our brief description of what happened, that our vehicle would be unsafe to drive a single more mile (which was impossible anyhow because it wouldn’t turn on), and to tow our vehicle to Hyundai dealership in Fayetteville, AR for repair on DECEMBER 27, 2022 at our own expense. 4. From what Hyundai, Fayetteville, AR's service engineer named Evan told us, they have replaced the fuse no less than four times and it kept blowing when they went to test the vehicle. After the basic fuse replacement, it caused the problem to become worse, and revealed an ICCU problem, that then revealed acceleration and charging problems, and the initial fuse problem still persisted. Codes kept popping up, and whenever they fixed the current issue, another one would present. Long story short, it turned out the vehicle was experiencing “mass power surges,” issues with the batteries, and displaying codes for reasons they were unsure of, causing the basic fuse replacement to “pop.” They even called in a Hyundai Engineer directly from corporate to try to fix the vehicle, but according to Evan, even he had no idea what was wrong with the vehicle and had left with some data.",IVOQ,N,,N,N,N,,,,,,,,,,,,,,,,,,,,V,,N,N,,,RANDOM
2195083,11730096,Hyundai Motor America,HYUNDAI,ELANTRA,2013,N,20260407,Y,0,0,UNKNOWN OR OTHER,SAIPAN,MP,KMHDH4AE1DU,20260409,20260409,,,My mother's vehicle caught fire while in park and it’s listed under a fire-risk recall. Another car got damage with the fire. I want to open a claim.,IVOQ,Y,,N,N,N,,,,,,,,,,,,,,,,,,,,V,,N,N,MP,,RANDOM
1798754,11454617,Hyundai Motor America,HYUNDAI,ELANTRA,2017,N,20220226,N,0,0,UNKNOWN OR OTHER,Van Lear,KY,5NPD74LF5HH,20220301,20220301,,,While driving on highway the vehicle quit running and would not restart. It seemed it lost power prior to completely dying. Check engine light came on when starting and had some hesitation but started then once on highway stalled out. Paint is also coming off hood color is Pearl White,IVOQ,N,,N,N,N,,,,,,25,,,,,,,,,,,,,,V,,N,N,,,RANDOM
1895104,11522177,Hyundai Motor America,HYUNDAI,SONATA,2017,N,20230513,N,0,0,UNKNOWN OR OTHER,Salem ,OR,KMHE24L31HA,20230515,20230515,,,Check Hybrid system. Turn off engine.  Driving one hour in 90 degree temperature and this warning appeared on dash with VERY loud warning. Warning continued until I found a safe spot to pull off the road out of traffic note loud warning continued until I was able to shut off the engine. ,IVOQ,N,,N,N,N,,,,,,59,,,,,,,,,,,,,,V,,N,N,,,RANDOM
2009038,11603406,Hyundai Motor America,HYUNDAI,SONATA,2012,N,20220601,N,0,0,VEHICLE SPEED CONTROL:ACCELERATOR PEDAL,North Augusta,SC,5NPEC4AB9CH,20240719,20240719,0,,"The contact owns a 2012 Hyundai Sonata. The contact stated that while her daughter was driving at undisclosed speeds, the vehicle was jerking abnormally. The passenger's side front tire was extremely hot. The contact stated that the RPM increased to high, and the vehicle lost motive power while driving. The contact stated that while the accelerator pedal was depressed, the vehicle was slow to respond. There was an abnormal electrical burning odor detected. The vehicle was hard to start. The contact stated that the check engine and ABS warning lights were illuminated. On several occasions, the vehicle was taken to the local dealer, who was unable to retrieve any DTC trouble codes. The bearing was fine but was replaced at the owner's request. The mechanic test-drove the vehicle for five hundred miles but was unable to duplicate the failure. The mechanic informed the contact that the ECM was fried. The ECM was replaced, but no update was provided. Additionally, the mechanic informed the contact that the wiring harness had a short circuit and that the wiring harness needed to be replaced. The vehicle was repaired, but the failure persisted. The manufacturer was contacted, but no assistance was provided. The failure mileage was unknown.",EVOQ,N,,N,N,N,,,,,,0,,,,,,,,,,,,,,V,,N,N,,,RANDOM
1821108,11470610,Hyundai Motor America,HYUNDAI,IONIQ HYBRID,2019,Y,20220620,Y,2,0,VEHICLE SPEED CONTROL,Lake Oswego,OR,KMHC75LC9KU,20220623,20220623,,,"One morning, my father turned on the car. It was still in Park. He and my mom heard a noise, as if my dad was pushing on the gas pedal, but he was not. They turned off the car, turned it on again, and everything seemed fine.  After driving for a bit, my father was back home and parking the car. Because of the way the parking lot is, you have to go slowly, less than 10 miles an hour, pushing on the gas a little to go up and incline and then turn right to slide into the parking spot as you break to finally park.  As he was pulling into the parking spot, the car suddenly accelerated uncontrollably, and crashed hard into the building ahead. It broke pieces of the building, and the entire front of the car is totaled. My parents saw fire under the hood and my mom suffered a hand injury.   They are otherwise unharmed.  I know Unintended Sudden Acceleration was an issue with Ioniq EVs from 2019. It looks like it is happening to the hybrids as well.  Thank you for looking into it. ",IVOQ,Y,,N,N,N,,,,,,10,,,,,,,,,,,,,,V,,N,Y,,,RANDOM
1932237,11547586,"Kia America, Inc.",KIA,NIRO PHEV,2022,N,20230930,N,0,0,ELECTRICAL SYSTEM,Weaverville,CA,KNDCC3LD2N5,20231001,20231001,,,"Hi,    We made an appointment for lube oil and filter change for Oct. 12 in Redding. We made the call because the dock to recharge the phone was getting very hot and the phone shut down and said it needed to cool down. Two different phones and several times. We do not use it. During the call to two different dealers. Harper Motors and Redding Kia the said there was another issues with no remedy but we should receive a recall by mail.    This leading to yesterday morning. Sept. 30, 2023 at 08:30. I put my foot on the brake and pushed the start button. Nothing happened except the dash read Check regenerative braking system and some other things then everything shut down and screen went black.    The dash made a winding down sound.  Everything shut down and locked. No response with the  FOB. Hatch will not open. No lights anywhere. I can not move the gear shift to move the gear shift.  It recommends moving the car away from structures and other cars. Because of fire danger. 2022 Kia Niro PHEV. As noted before we made contact with the dealers, They said to have it towed to them. It is a fire safety issue. How do I get it out of my garage with it locked down like this. ",IVOQ,N,,N,N,N,,,,,,,,,,,,,,,,,,,,V,,N,N,,,RANDOM
2060783,11639362,Hyundai Motor America,HYUNDAI,SONATA,2014,N,20250128,N,0,0,ELECTRICAL SYSTEM,Marietta,GA,KMHEC4A42EA,20250129,20250129,,,When I was driving on highway check brake warning came up with hybrid system warning I wasn’t be able to stop or accelerate I slowed down and pulled over might caused a big accident.,IVOQ,N,,N,N,N,,,,,,70,,,,,,,,,,,,,,V,,N,N,,,RANDOM
2126696,11684794,"Kia America, Inc.",KIA,SOUL,2014,N,20250902,N,0,0,UNKNOWN OR OTHER,Dallas,TX,KNDJN2A21E7,20250903,20250903,,,"On [XXX], my 2014 Kia Soul received the PI2002A Knock Sensor Detection System (KSDS) ECU update at Southwest Kia, 39650 Lyndon B Johnson Freeway South, Dallas, TX 75237. After the update, the engine sustained catastrophic damage (a hole in the block). Southwest Kia informed me that Kia denied the engine replacement under warranty, which is inconsistent with the official PI2002A bulletins (NHTSA #MC-10172065 and MC-10189615). These bulletins clearly state that the short block warranty is extended and that engine replacement is covered for this type of failure.  I am requesting an immediate review of my case, a written explanation for the denial, and a timeline for resolution, as my vehicle is currently inoperable. Attached are service records, photos of the engine damage, and copies of the PI2002A bulletins for reference.  INFORMATION REDACTED PURSUANT TO THE FREEDOM OF INFORMATION ACT (FOIA), 5 U.S.C. 552(B)(6)",IVOQ,N,,N,N,N,,,,,,,,,,,,,,,,,,,,V,,N,N,,,RANDOM
2098867,11665716,"Kia America, Inc.",KIA,SORENTO,2023,N,20250606,N,0,0,BACK OVER PREVENTION: REARVIEW SYSTEM BRAKING,Pittsburgh,PA,5XYRHDLF0PG,20250609,20250609,,,"Even though the dealership reports that safety recall 23V610 / SC280 for the mounting clip replacement was completed on 2/16/24, my rearview camera has just fell out of its housing, hanging by its wires, with the mounting clips laying broken in my driveway. My rearview camera is currently unusable; its taped up so that it is not just swinging by the wires.  When I contacted my dealership, they are pretty sure they can get this work covered under the warranty, but they are not sure. And my VIN# is currently not pulling up any ""Active Recalls"".  Either the clips they used to replace the previous clips were also bad, or the dealership didnt actually complete the work as reported.",IVOQ,N,,N,N,N,,,,,,,,,,,,,,,,,,,,V,,N,N,,,RANDOM
2172372,11714963,Hyundai Motor America,HYUNDAI,IONIQ 5,2022,N,20260107,N,0,0,ELECTRICAL SYSTEM,Allentown,PA,KM8KNDAF6NU,20260202,20260202,,,"My vehicle recently experienced issues charging. It would not charge using a Level 1 or 2 charger, but would allow limited Level 3 charging. After having the vehicle inspected by a Hyundai dealership, they confirmed that the ICCU had failed for the vehicle. ",IVOQ,N,,N,N,N,,,,,,,,,,,,,,,,,,,,V,,N,N,,,RANDOM
2192077,11728130,Hyundai Motor America,HYUNDAI,TUCSON,2026,N,20260302,N,0,0,ELECTRICAL SYSTEM,Parker,CO,KM8JBDD19TU,20260330,20260330,,,"I am writing to formally document a serious, recurring safety defect in ou 2026 Hyundai Tucson Hybrid, purchased less than a month ago. The vehicle has now exhibited multiple distinct dashboard warning faults related to the electronic shifter system, has left me stranded on more than one occasion, and has been sitting at Schomp Hyundai in [XXX] , for the second time, for over one week, with no resolution. The dealership has been unable — or unwilling — to properly diagnose the issue despite photographic documentation of the active fault warnings and the existence of Hyundai-issued Technical Service Bulletins directly addressing this problem. This letter serves as formal written notice pursuant to Colorado's Lemon Law (C.R.S. § 42-10-101 et seq. Since taking delivery, I have experienced multiple occurrences of two distinct dashboard fault warnings on this vehicle. Both have been photographically documented with date-stamped images: • ""Shifter System Malfunction! Service Immediately"" — The vehicle became inoperable and could not shift gears, leaving me stranded. ""PARK Malfunction. Engage parking brake when parking vehicle."" — A secondary fault indicating failure of the electronic park system, creating a serious safety hazard. These faults are not related to any collision or external damage. They are pre-existing manufacturing defects that began occurring in the first week of purchase. Notably, this is a known and documented issue affecting Hyundai Tucson Hybrid models. Hyundai has issued Technical Service Bulletins TSB #21-AT-007H and TSB #21-AT-009H. I drove the vehicle approximately 8 times (including to and from the repair center) and have had the issue multiple times.I am formally requesting the following immediate actions: • Direct the dealership to perform a complete GDS historical DTC scan per TSB #21-AT-007H and #21-AT-009H and provide full written results.  INFORMATION REDACTED PURSUANT TO THE FREEDOM OF INFORMATION ACT (FOIA), 5 U.S.C. 552(B)(6)",IVOQ,N,,N,N,N,,,,,,,,,,,,,,,,,,,,V,,N,N,CO,,RANDOM
1996139,11591991,Hyundai Motor America,HYUNDAI,ELANTRA,2021,N,20230309,N,0,0,UNKNOWN OR OTHER,Clearwater,FL,KMHLL4AGXMU,20240602,20240602,,,Significant water leak which I believe is due to a failure in the door seals. My personal safety is at risk due to a mold issue. The problem has been reproduced and confirmed by the Hyundai dealership’s service department (multiple visits). This problem is well documented by many individuals in the Hyundai Forums site. The results were the dealership pushes the vehicle back at the consumer without it being corrected. Problem has been occurring since purchased. I recognized the issue in early 2023,IVOQ,N,,N,N,N,,,,,,,,,,,,,,,,,,,,V,,N,N,,,RANDOM
1791071,11449465,Hyundai Motor America,HYUNDAI,KONA,2022,N,20211127,N,0,0,FORWARD COLLISION AVOIDANCE: ADAPTIVE CRUISE CONTROL,Ammon,ID,KM8K5CA38NU,20220130,20220130,,,"The cruise control does not engage. When setting the adaptive cruise control I have had the car slow down 15-20 mph before turning the cruise control off because traffic is backing up behind me and I become a hazard on the road. I have taken it to 2 different dealerships, the one I purchased the car from and one that is closer to my home as I moved and now live in a different state from where I purchased the car. Both dealerships claimed they were not able to replicate the issue. However, every time I drive the car and try to use cruise control I have the same issue of the cruise control not engaging. The car dashboard's speed indicator is supposed to turn green and make a ""ding"" sound when you engage the cruise control at the posted speed limit. My car does not do this. The speed limit on the freeway here is 80mph and it will turn green and ""ding"" at 81mph but still not actually engage and maintain the speed. I have had numerous incidents where cars behind me honk and have to go around because I was slowing down so much. I spoke with another 2022 Kona owner and they stated that they have had the same problem and they were told the same thing by a different dealership that they bought their vehicle from. ",IVOQ,N,,N,N,N,,,,,,,,,,,,,,,,,,,,V,,N,N,,,RANDOM
2113390,11675793,Hyundai Motor America,HYUNDAI,PALISADE,2025,N,20241203,N,0,0,LANE DEPARTURE: WARNING,PALM BAY,FL,KM8R44GE2SU,20250724,20250724,,,"The Lane Guidance and Lane assist malfunctions / failures numerous times at highway speeds. The vehicle tried to forcibly steer me into the next lane for no reason. Typically a vehicle is approaching from the rear and the acting by the Palisade would have caused a serious accident. This has been documented numerous time since November 25, 2024. The steering places excessive force on the steering which is very traumatic on the highway driving at posted speeds. In the event my wife was driving the 2025 Palisade, she wouldn't have been able to keep the vehicle centered in the lane, due to the forces on the steering wheel. This has occurred numerous times over the past 8 months. No real help from Hyundai Corporate Cust Serv,  since Dec 2024.  Claim  40091189  While going down a 4 lane road, Babcock Road, Palm Bay FL, the at around 40 mph the vehicle immediately reduced my speed to 20 mph. This nearly caused a major accident. There was no reason for the drop in speed so abruptly. I had not touched any controls, cruise control was not on, there wasn't a school zone. Something caused the vehicle to reach that way immediately. By pushing on the gas pedal did nothing. It remained at around 20 mph till I was able to turn off into a parking lot and the engine turned off. There are numerous intermittent problems with this 2025 Palisade that need to be addressed be for the vehicle causes a major accident and lives lost.  The vehicle has been back to dealerships 6 times and no real troubleshooting took place. This has caused numerous near death traumatic experiences. 2025 Palisade is very dangerous at highway speed with the additional Steering safety features turned on. The vehicle has been back to dealerships 6 times and no real troubleshooting took place. This has caused numerous near death traumatic experiences. 2025 Palisade is very dangerous at highway speed with the additional Steering safety features turned on.  There are photos, videos and other documentation available. ",IVOQ,N,,N,N,N,,,,,,65,,,,,,,,,,,,,,V,,N,N,,,RANDOM
1859987,11497870,"Kia America, Inc.",KIA,SOUL,2020,N,20221130,N,0,0,FORWARD COLLISION AVOIDANCE: WARNINGS,Deltona,FL,KNDJ63AU1L7,20221217,20221217,,,The vehicle stalls and turns off while stopped. The vehicle turns off quickly with all dash light sensors turned on with a front collision warning. The vehicle can only be restarted when is boosted. The battery was checked and is in good working condition. ,IVOQ,N,,N,N,N,,,,,,,,,,,,,,,,,,,,V,,N,N,,,RANDOM
1967888,11572261,Hyundai Motor America,HYUNDAI,SANTA FE,2014,N,20230323,N,0,0,UNKNOWN OR OTHER,Anniston,AL,KM8SRDHFXEU,20240215,20240215,,,"For months there was a knocking/rattling sound coming from under my hood… I never got my oil changed at Hyundai. I always went to 10 minute express for my oil changes. The one time i do decide to go to Hyundai for an oil change/ inspection my car engine seizes 2 months later. Found out it seized due to no oil, there was no low oil pressure light on no warning light nothing. Hyundai doesn’t and won’t fix the issue. Mind you I’ve been keeping my car maintenance every 3 months when it comes to an oil change. The day i decide to use Hyundai is the reason why my car stopped working. After taking the dead car to Hyundai they said after 200,000 miles the engine drinks a lot of oil. Again nobody told me this til after. I’m very upset with Hyundai cause they don’t see their fault in this. Since I’m not the original owner it’s nothing they can do. I got extended warranty on it and it was a waste of money",IVOQ,N,,N,N,N,,,,,,55,,,,,,,,,,,,,,V,,N,N,,,RANDOM
1906724,11530138,Hyundai Motor America,HYUNDAI,ELANTRA,2017,Y,20221026,N,1,0,ELECTRICAL SYSTEM,Tamarac,FL,5NPD84LF5HH,20230703,20230703,25000,,"The contact owns a 2017 Hyundai Elantra. The contact stated upon coming to a complete stop, the vehicle accelerated unintendedly over a concrete bar and drove up a hill. The contact depressed the brake pedal but to no avail. The contact steered the vehicle to the right direction to avoid entering a pool. She then crashed into multiple objects including trees, concrete parking bars, and multiple vehicles before coming to a stop. The air bags did not deploy upon impact. The contact was taken to the hospital by ambulance and was treated for injuries to her neck and back. A police report was filed. Due to the failure, the vehicle was towed to an independent tow yard where it was destroyed. Parking barriers and trees were damaged as a result of the failure.  The manufacturer was notified of the failure. The failure mileage was approximately 25,000. ",EVOQ,Y,,N,N,N,,,,,,,,,,,,,,,,,,,,V,,Y,Y,,,RANDOM
1841710,11485142,"Kia America, Inc.",KIA,TELLURIDE,2022,N,20220901,N,0,0,VEHICLE SPEED CONTROL,Mount Sterling,KY,5XYP6DHC3NG,20220919,20220919,,,1. Speedometer displayed 0 mph on the display screen and odometer. It took 2 days for it to start working again.   2. Backup camera displayed a green screen with a error message for 4 hours. ,IVOQ,N,,N,N,N,,,,,,0,,,,,,,,,,,,,,V,,N,N,,,RANDOM
1975226,11577338,"Kia America, Inc.",KIA,SPORTAGE,2017,N,20231115,N,0,0,ELECTRICAL SYSTEM,Lutz,FL,KNDPN3AC6H7,20240314,20240314,71000,,"The contact owns a 2017 Kia Sportage. The contact stated while reversing in a parking lot, the contact became aware that there was a significant amount of engine oil had leaked onto the ground. The contact stated that she added oil to the vehicle and drove to the residence. The vehicle was then towed to the dealer, where it was diagnosed that the oil pressure switch had failed, causing oil intrusion in the wiring harness and in the computer and components. The dealer determined that the wiring harness, the computer, and the oil pressure switch needed to be replaced. The vehicle was not repaired. The manufacturer was notified of the failure, but no assistance was provided. The failure mileage was approximately 71,000. ",EVOQ,N,,N,N,N,,,,,,,,,,,,,,,Kia of Wesley Chapel,,Wesley Chapel,FL, 33543,V,,N,Y,,,RANDOM
2163632,11709161,Hyundai Motor America,HYUNDAI,SONATA,2009,N,20251201,N,0,0,ELECTRICAL SYSTEM,High Point,NC,5NPET46C49H,20260106,20260106,,,"Brakes seize up while driving and then cannot move the vehicle. This causes a dangerous situation while driving and then breaks lock up and cannot move car even though vehicle is on and then stopped for a stop light. Car must then be turned off and sit for about 30 minutes so it can unseize and when that happens, you can then resume driving and then check engine light comes on. Brake lights were staying on even when vehicle is shut completely off. ABS and ESC lights stay on consistently and never turn off. Vehicle brake switch was replaced at Carolina Hyundai of high point, NC. So break lights have been repaired. They had to order the stop switch lamp replacement for recall as it was never done and will be fixed in next week. 3 door handles fell off and cannot open the rear driver side door at all. Window electric system won’t let windows go up and down and had to make a latch pull string to open driver door. Passenger door will not open at all and no handle and is a dangerous situation. Break switch not being replaced would have cause an electrical fire and is a complete dangerous vehicle even after being inspected less than a week ago",IVOQ,N,,N,N,N,,,,,,45,,,,,,,,,,,,,,V,,N,N,,,RANDOM
1937615,11551339,Hyundai Motor America,HYUNDAI,SONATA,2014,N,20231023,N,0,0,ELECTRICAL SYSTEM,Miami Shores,FL,5NPEB4AC1EH,20231023,20231023,,,"when using the turn signals, either way, the headlights cut off. sometimes they flicker back on and sometimes they stay off.",IVOQ,N,,N,N,N,,,,,,,,,,,,,,,,,,,,V,,N,N,,,RANDOM
