CMPLID,ODINO,MFR_NAME,MAKETXT,MODELTXT,YEARTXT,CRASH,FAILDATE,FIRE,INJURED,DEATHS,COMPDESC,CITY,STATE,VIN,DATEA,LDATE,MILES,OCCURENCES,CDESCR,CMPL_TYPE,POLICE_RPT_YN,PURCH_DT,ORIG_OWNER_YN,ANTI_BRAKES_YN,CRUISE_CONT_YN,NUM_CYLS,DRIVE_TRAIN,FUEL_SYS,FUEL_TYPE,TRANS_TYPE,VEH_SPEED,DOT,TIRE_SIZE,LOC_OF_TIRE,TIRE_FAIL_TYPE,ORIG_EQUIP_YN,MANUF_DT,SEAT_TYPE,RESTRAINT_TYPE,DEALER_NAME,DEALER_TEL,DEALER_CITY,DEALER_STATE,DEALER_ZIP,PROD_TYPE,REPAIRED_YN,MEDICAL_ATTN,VEHICLES_TOWED_YN,UNKNOWN_50,UNKNOWN_51,sample_group
1843077,11486092,"Kia America, Inc.",KIA,OPTIMA,2017,N,20220923,N,0,0,VEHICLE SPEED CONTROL,Savannah ,GA,5XXGW4L23HG,20220923,20220923,,,"I was driving with an SUV in front of me at 18-wheeler in front of them. This is on a road where the speed limit is 65 however there's a section on 301 where there's a traffic light. All three vehicles came to a slow normal stop  and the adaptive cruise control was doing a good job of slowing the vehicle down without my input. But the SUV when we were at about stopping speed but had not yet come to a complete stop, the SUV switched to the left lane. At which point I was maybe 20 ft behind the 18-wheeler and all of a sudden the car is adaptive cruise control tried to accelerate the car back up to the setting of 65. It didn't register the 18-wheeler at all It just registered that the car in front of me had cleared the space and if I had not been paying attention and immediately applied the brakes to stop the car manually It absolutely would have accelerated directly into the back of the 18-wheeler. I was maybe 5 ft and it was still accelerating when I slammed on the brakes. I've been able to since reproduce the effects, it doesn't register 18 wheelers correctly in this specific situation as vehicles. I've even had the camera recalibrated in between tests.   I have everything on video but unfortunately do not have access to the car's computer logs. I would be willing to send in my ECU for whatever is needed to identify this further.",IVOQ,N,,N,N,N,,,,,,65,,,,,,,,,,,,,,V,,N,N,,,A_multi_cmplid
1843078,11486092,"Kia America, Inc.",KIA,OPTIMA,2017,N,20220923,N,0,0,UNKNOWN OR OTHER,Savannah ,GA,5XXGW4L23HG,20220923,20220923,,,"I was driving with an SUV in front of me at 18-wheeler in front of them. This is on a road where the speed limit is 65 however there's a section on 301 where there's a traffic light. All three vehicles came to a slow normal stop  and the adaptive cruise control was doing a good job of slowing the vehicle down without my input. But the SUV when we were at about stopping speed but had not yet come to a complete stop, the SUV switched to the left lane. At which point I was maybe 20 ft behind the 18-wheeler and all of a sudden the car is adaptive cruise control tried to accelerate the car back up to the setting of 65. It didn't register the 18-wheeler at all It just registered that the car in front of me had cleared the space and if I had not been paying attention and immediately applied the brakes to stop the car manually It absolutely would have accelerated directly into the back of the 18-wheeler. I was maybe 5 ft and it was still accelerating when I slammed on the brakes. I've been able to since reproduce the effects, it doesn't register 18 wheelers correctly in this specific situation as vehicles. I've even had the camera recalibrated in between tests.   I have everything on video but unfortunately do not have access to the car's computer logs. I would be willing to send in my ECU for whatever is needed to identify this further.",IVOQ,N,,N,N,N,,,,,,65,,,,,,,,,,,,,,V,,N,N,,,A_multi_cmplid
1843079,11486092,"Kia America, Inc.",KIA,OPTIMA,2017,N,20220923,N,0,0,FORWARD COLLISION AVOIDANCE: ADAPTIVE CRUISE CONTROL,Savannah ,GA,5XXGW4L23HG,20220923,20220923,,,"I was driving with an SUV in front of me at 18-wheeler in front of them. This is on a road where the speed limit is 65 however there's a section on 301 where there's a traffic light. All three vehicles came to a slow normal stop  and the adaptive cruise control was doing a good job of slowing the vehicle down without my input. But the SUV when we were at about stopping speed but had not yet come to a complete stop, the SUV switched to the left lane. At which point I was maybe 20 ft behind the 18-wheeler and all of a sudden the car is adaptive cruise control tried to accelerate the car back up to the setting of 65. It didn't register the 18-wheeler at all It just registered that the car in front of me had cleared the space and if I had not been paying attention and immediately applied the brakes to stop the car manually It absolutely would have accelerated directly into the back of the 18-wheeler. I was maybe 5 ft and it was still accelerating when I slammed on the brakes. I've been able to since reproduce the effects, it doesn't register 18 wheelers correctly in this specific situation as vehicles. I've even had the camera recalibrated in between tests.   I have everything on video but unfortunately do not have access to the car's computer logs. I would be willing to send in my ECU for whatever is needed to identify this further.",IVOQ,N,,N,N,N,,,,,,65,,,,,,,,,,,,,,V,,N,N,,,A_multi_cmplid
1859969,11497859,Hyundai Motor America,HYUNDAI,ELANTRA GT,2018,N,20221119,N,0,0,LANE DEPARTURE: BLIND SPOT DETECTION,Ponte Vedra Beach,FL,KMHH35LE4JU,20221217,20221217,,,"The collision warning system has failed 4 or 5 times since I bought the car new in March of 2019.  When the system stops working, the warning ""Check BSD"" appears on the driver's display. A couple of times the system started working without service. Other times service was required. The last time Hyundai service said the system went out of calibration. No explanation of how that would occur. They re-calibrated the system. Of course, once the system stops working, I have to remember that I won't get a warning when changing lanes or parking, so I must be sure to use extra careful. (I always look when I change lanes, but the warning system gives me extra confidence. I am sure many other people just rely on the system.)",IVOQ,N,,N,N,N,,,,,,,,,,,,,,,,,,,,V,,N,N,,,A_multi_cmplid
1859970,11497859,Hyundai Motor America,HYUNDAI,ELANTRA GT,2018,N,20221119,N,0,0,FORWARD COLLISION AVOIDANCE: WARNINGS,Ponte Vedra Beach,FL,KMHH35LE4JU,20221217,20221217,,,"The collision warning system has failed 4 or 5 times since I bought the car new in March of 2019.  When the system stops working, the warning ""Check BSD"" appears on the driver's display. A couple of times the system started working without service. Other times service was required. The last time Hyundai service said the system went out of calibration. No explanation of how that would occur. They re-calibrated the system. Of course, once the system stops working, I have to remember that I won't get a warning when changing lanes or parking, so I must be sure to use extra careful. (I always look when I change lanes, but the warning system gives me extra confidence. I am sure many other people just rely on the system.)",IVOQ,N,,N,N,N,,,,,,,,,,,,,,,,,,,,V,,N,N,,,A_multi_cmplid
1859971,11497859,Hyundai Motor America,HYUNDAI,ELANTRA GT,2018,N,20221119,N,0,0,BACK OVER PREVENTION: REARVIEW SYSTEM BRAKING,Ponte Vedra Beach,FL,KMHH35LE4JU,20221217,20221217,,,"The collision warning system has failed 4 or 5 times since I bought the car new in March of 2019.  When the system stops working, the warning ""Check BSD"" appears on the driver's display. A couple of times the system started working without service. Other times service was required. The last time Hyundai service said the system went out of calibration. No explanation of how that would occur. They re-calibrated the system. Of course, once the system stops working, I have to remember that I won't get a warning when changing lanes or parking, so I must be sure to use extra careful. (I always look when I change lanes, but the warning system gives me extra confidence. I am sure many other people just rely on the system.)",IVOQ,N,,N,N,N,,,,,,,,,,,,,,,,,,,,V,,N,N,,,A_multi_cmplid
1862545,11499666,"Kia America, Inc.",KIA,RONDO,2009,N,20220908,N,0,0,ELECTRICAL SYSTEM,Coventry,RI,KNAFG529297,20230101,20230101,,,I had to replace the tires on this car several times in 3 years. They alarm had a glitch that the car would not start and you had to take it specifically to a Kia dealer to have they alarm reprogrammed. Even upon repairs to your local mechanic. Costing them more money and me more money because they could not get in the car by pass they alarm without using kia first to reprogram it.  The brakes locked up. The lights woukd go off for airbag and stay on. The anti lick brake light would stay on .. Very dangerous. I had to spend more money to because of they alarm. Even just replacing the battery in the alarm remote cost more money for the remote and the programming of the remote . You could not just replace the battery. The tires and brakes gave me several issues in 3 years  To the tube of close 3000. And that's being fair. ,IVOQ,N,,N,N,N,,,,,,,,,,,,,,,,,,,,V,,N,N,,,A_multi_cmplid
1862546,11499666,"Kia America, Inc.",KIA,RONDO,2009,N,20220908,N,0,0,FORWARD COLLISION AVOIDANCE: AUTOMATIC EMERGENCY BRAKING,Coventry,RI,KNAFG529297,20230101,20230101,,,I had to replace the tires on this car several times in 3 years. They alarm had a glitch that the car would not start and you had to take it specifically to a Kia dealer to have they alarm reprogrammed. Even upon repairs to your local mechanic. Costing them more money and me more money because they could not get in the car by pass they alarm without using kia first to reprogram it.  The brakes locked up. The lights woukd go off for airbag and stay on. The anti lick brake light would stay on .. Very dangerous. I had to spend more money to because of they alarm. Even just replacing the battery in the alarm remote cost more money for the remote and the programming of the remote . You could not just replace the battery. The tires and brakes gave me several issues in 3 years  To the tube of close 3000. And that's being fair. ,IVOQ,N,,N,N,N,,,,,,,,,,,,,,,,,,,,V,,N,N,,,A_multi_cmplid
1899668,11525342,"Kia America, Inc.",KIA,TELLURIDE,2023,N,20230602,N,0,0,ELECTRICAL SYSTEM,Bellbrook,OH,5XYP3DGC6PG,20230605,20230605,,,"The driver dashboard went blank except for randomly flashing nonsense numbers. Vehicle speed, fuel level, engine RPM and other vehicle information was lost. Additionally forward collision avoidance, lane keep and departure, adaptive cruise, emergency braking and blind spot warning systems became inactive. I am unsure if the antilock brake system and stability controls are functional. My safety was put at risk because i was unsure of vehicle speed and loosing all driver assistance tools. The problem has been persistent since it 1st occurred. The vehicle is going to the dealer today, 05 June 2023. Immediately before the driver dash going blank, the entire driver dashboard showed all warnings lights before going blank.",IVOQ,N,,N,N,N,,,,,,15,,,,,,,,,,,,,,V,,N,N,,,A_multi_cmplid
1899669,11525342,"Kia America, Inc.",KIA,TELLURIDE,2023,N,20230602,N,0,0,VEHICLE SPEED CONTROL,Bellbrook,OH,5XYP3DGC6PG,20230605,20230605,,,"The driver dashboard went blank except for randomly flashing nonsense numbers. Vehicle speed, fuel level, engine RPM and other vehicle information was lost. Additionally forward collision avoidance, lane keep and departure, adaptive cruise, emergency braking and blind spot warning systems became inactive. I am unsure if the antilock brake system and stability controls are functional. My safety was put at risk because i was unsure of vehicle speed and loosing all driver assistance tools. The problem has been persistent since it 1st occurred. The vehicle is going to the dealer today, 05 June 2023. Immediately before the driver dash going blank, the entire driver dashboard showed all warnings lights before going blank.",IVOQ,N,,N,N,N,,,,,,15,,,,,,,,,,,,,,V,,N,N,,,A_multi_cmplid
1899670,11525342,"Kia America, Inc.",KIA,TELLURIDE,2023,N,20230602,N,0,0,FORWARD COLLISION AVOIDANCE: WARNINGS,Bellbrook,OH,5XYP3DGC6PG,20230605,20230605,,,"The driver dashboard went blank except for randomly flashing nonsense numbers. Vehicle speed, fuel level, engine RPM and other vehicle information was lost. Additionally forward collision avoidance, lane keep and departure, adaptive cruise, emergency braking and blind spot warning systems became inactive. I am unsure if the antilock brake system and stability controls are functional. My safety was put at risk because i was unsure of vehicle speed and loosing all driver assistance tools. The problem has been persistent since it 1st occurred. The vehicle is going to the dealer today, 05 June 2023. Immediately before the driver dash going blank, the entire driver dashboard showed all warnings lights before going blank.",IVOQ,N,,N,N,N,,,,,,15,,,,,,,,,,,,,,V,,N,N,,,A_multi_cmplid
1901711,11526766,Hyundai Motor America,HYUNDAI,SANTA CRUZ,2023,N,20221201,N,0,0,ELECTRICAL SYSTEM,East patchouge,NY,5NTJBDAE3PH,20230613,20230613,,,"The most major problem that occurred on 2-3 different occasions is that the emergency braking system activated for no reason on one occasion, almost causing a Rear end collision with a person behind me. No one to my sides, and in front of me on all of the occasions. Headlights on the automatic, setting on a bright sunny day, will turn off and on no change in lighting which annoys other drivers because they think I’m flashing them.  After starting the car in Drive the first time I break and then go to accelerate there’s a delay in the acceleration. as well as other times while driving.  Today, the back up camera didn’t shut off when shifting into drive like it normally does it didn’t go off until I went into parking pushed the radio button.   I’m pretty sure it’s a computer issue  ",IVOQ,N,,N,N,N,,,,,,,,,,,,,,,,,,,,V,,N,N,,,A_multi_cmplid
1901712,11526766,Hyundai Motor America,HYUNDAI,SANTA CRUZ,2023,N,20221201,N,0,0,VEHICLE SPEED CONTROL,East patchouge,NY,5NTJBDAE3PH,20230613,20230613,,,"The most major problem that occurred on 2-3 different occasions is that the emergency braking system activated for no reason on one occasion, almost causing a Rear end collision with a person behind me. No one to my sides, and in front of me on all of the occasions. Headlights on the automatic, setting on a bright sunny day, will turn off and on no change in lighting which annoys other drivers because they think I’m flashing them.  After starting the car in Drive the first time I break and then go to accelerate there’s a delay in the acceleration. as well as other times while driving.  Today, the back up camera didn’t shut off when shifting into drive like it normally does it didn’t go off until I went into parking pushed the radio button.   I’m pretty sure it’s a computer issue  ",IVOQ,N,,N,N,N,,,,,,,,,,,,,,,,,,,,V,,N,N,,,A_multi_cmplid
1901713,11526766,Hyundai Motor America,HYUNDAI,SANTA CRUZ,2023,N,20221201,N,0,0,FORWARD COLLISION AVOIDANCE: AUTOMATIC EMERGENCY BRAKING,East patchouge,NY,5NTJBDAE3PH,20230613,20230613,,,"The most major problem that occurred on 2-3 different occasions is that the emergency braking system activated for no reason on one occasion, almost causing a Rear end collision with a person behind me. No one to my sides, and in front of me on all of the occasions. Headlights on the automatic, setting on a bright sunny day, will turn off and on no change in lighting which annoys other drivers because they think I’m flashing them.  After starting the car in Drive the first time I break and then go to accelerate there’s a delay in the acceleration. as well as other times while driving.  Today, the back up camera didn’t shut off when shifting into drive like it normally does it didn’t go off until I went into parking pushed the radio button.   I’m pretty sure it’s a computer issue  ",IVOQ,N,,N,N,N,,,,,,,,,,,,,,,,,,,,V,,N,N,,,A_multi_cmplid
2010846,11604681,Hyundai Motor America,HYUNDAI,SANTA FE,2016,N,20240630,N,0,0,UNKNOWN OR OTHER,Beaver Falls,PA,5XYZUDLBXGG,20240726,20240726,,,"Vehicle was driven on a highway approximately 45-50 mph when a loud knocking sound occured. The vehicle began to shake erratically and a bunch of lights displayed. I pulled over at a safety point and turned the vehicle off to inspect it. A large amount of smoke poured from under the hood. The vehicle sat for about 45 minutes to cool down before I attempted to start it again. The engine continued to make a loud knocking sound and kept stalling. At the given time of engine failure, I was driving on a fairly busy highway with my two toddlers where we were forced in a dangerous situation to be struck by a vehicle. Hours later, I went back to start the vehicle where I was able to get it started and drive approximately 15 mph to a safer area for the vehicle to be parked. The vehicle has been at the Hyundai Bowser Chippewa location in Beaver Falls, PA. I was denied for any assistance through Hyundai and the BBB-Hyundai due to 3 open recalls, mainly the engine knock system not being updated. All issues and diagnostics were conducted at the dealership where the vehicle is being stored. No police report has been filed, nor was an insurance claim conducted. No lights or warnings came about until the engine started to noticably fail. I didn't receive any notifications from Hyundai regarding recalls, and nothing is displayed on the NHTSA site. ",IVOQ,N,,N,N,N,,,,,,45,,,,,,,,,,,,,,V,,N,N,,,A_multi_cmplid
2010847,11604681,Hyundai Motor America,HYUNDAI,SANTA FE,2016,N,20240630,N,0,0,BACK OVER PREVENTION: WARNINGS,Beaver Falls,PA,5XYZUDLBXGG,20240726,20240726,,,"Vehicle was driven on a highway approximately 45-50 mph when a loud knocking sound occured. The vehicle began to shake erratically and a bunch of lights displayed. I pulled over at a safety point and turned the vehicle off to inspect it. A large amount of smoke poured from under the hood. The vehicle sat for about 45 minutes to cool down before I attempted to start it again. The engine continued to make a loud knocking sound and kept stalling. At the given time of engine failure, I was driving on a fairly busy highway with my two toddlers where we were forced in a dangerous situation to be struck by a vehicle. Hours later, I went back to start the vehicle where I was able to get it started and drive approximately 15 mph to a safer area for the vehicle to be parked. The vehicle has been at the Hyundai Bowser Chippewa location in Beaver Falls, PA. I was denied for any assistance through Hyundai and the BBB-Hyundai due to 3 open recalls, mainly the engine knock system not being updated. All issues and diagnostics were conducted at the dealership where the vehicle is being stored. No police report has been filed, nor was an insurance claim conducted. No lights or warnings came about until the engine started to noticably fail. I didn't receive any notifications from Hyundai regarding recalls, and nothing is displayed on the NHTSA site. ",IVOQ,N,,N,N,N,,,,,,45,,,,,,,,,,,,,,V,,N,N,,,A_multi_cmplid
2062173,11640303,Hyundai Motor America,HYUNDAI,IONIQ 5,2023,N,20250103,N,0,0,FORWARD COLLISION AVOIDANCE: ADAPTIVE CRUISE CONTROL,CHAPIN,SC,KM8KR4AE2PU,20250203,20250203,,,"Condensation builds in front of the camera. The car starts jerking all over the road with no warning. There is no error other than noticing that the car cannot keep itself in the lane. When trying to disable the features, they get turned back on automatically. ",IVOQ,N,,N,N,N,,,,,,70,,,,,,,,,,,,,,V,,N,N,,,A_multi_cmplid
2062174,11640303,Hyundai Motor America,HYUNDAI,IONIQ 5,2023,N,20250103,N,0,0,LANE DEPARTURE: ASSIST,CHAPIN,SC,KM8KR4AE2PU,20250203,20250203,,,"Condensation builds in front of the camera. The car starts jerking all over the road with no warning. There is no error other than noticing that the car cannot keep itself in the lane. When trying to disable the features, they get turned back on automatically. ",IVOQ,N,,N,N,N,,,,,,70,,,,,,,,,,,,,,V,,N,N,,,A_multi_cmplid
2062175,11640303,Hyundai Motor America,HYUNDAI,IONIQ 5,2023,N,20250103,N,0,0,LANE DEPARTURE: WARNING,CHAPIN,SC,KM8KR4AE2PU,20250203,20250203,,,"Condensation builds in front of the camera. The car starts jerking all over the road with no warning. There is no error other than noticing that the car cannot keep itself in the lane. When trying to disable the features, they get turned back on automatically. ",IVOQ,N,,N,N,N,,,,,,70,,,,,,,,,,,,,,V,,N,N,,,A_multi_cmplid
2087536,11657839,"Kia America, Inc.",KIA,TELLURIDE,2020,N,20240915,N,0,0,UNKNOWN OR OTHER,Westerly,RI,5XYP5DHC8LG,20250430,20250430,,,"the center infotainment screen has turned green. sometimes a hazy green, othertimes almost a solid green which affects the back up camera system when you are trying to back up and not hit anyone or anything. I have brought to the dealership and they stated the head unit is defective and needs replacement. I elevated to Kia Customer Care and they stated that because it is out of the 36,000 mile warranty they would not help. I even stated that as car is not a newer car was not asking for a brand new unit, but asked if they would at least put in a cheaper re-manufactured unit due to the safety issue and they denied that as well. I am on the kia telluride forum and multiple other people are having this issue. this is a defective part and as it is related to a safety issue needs to be replaced and covered by KIA. [XXX]  INFORMATION REDACTED PURSUANT TO THE FREEDOM OF INFORMATION ACT (FOIA), 5 U.S.C. 552(B)(6)",IVOQ,N,,N,N,N,,,,,,,,,,,,,,,,,,,,V,,N,N,,,A_multi_cmplid
2087537,11657839,"Kia America, Inc.",KIA,TELLURIDE,2020,N,20240915,N,0,0,ELECTRICAL SYSTEM,Westerly,RI,5XYP5DHC8LG,20250430,20250430,,,"the center infotainment screen has turned green. sometimes a hazy green, othertimes almost a solid green which affects the back up camera system when you are trying to back up and not hit anyone or anything. I have brought to the dealership and they stated the head unit is defective and needs replacement. I elevated to Kia Customer Care and they stated that because it is out of the 36,000 mile warranty they would not help. I even stated that as car is not a newer car was not asking for a brand new unit, but asked if they would at least put in a cheaper re-manufactured unit due to the safety issue and they denied that as well. I am on the kia telluride forum and multiple other people are having this issue. this is a defective part and as it is related to a safety issue needs to be replaced and covered by KIA. [XXX]  INFORMATION REDACTED PURSUANT TO THE FREEDOM OF INFORMATION ACT (FOIA), 5 U.S.C. 552(B)(6)",IVOQ,N,,N,N,N,,,,,,,,,,,,,,,,,,,,V,,N,N,,,A_multi_cmplid
2091540,11660630,Hyundai Motor America,HYUNDAI,SONATA,2024,N,20250421,N,0,0,FORWARD COLLISION AVOIDANCE: WARNINGS,Fairhope,AL,KMHL64JA6RA,20250513,20250513,,,"I have not had accident in vehicle. There is a driver attention warning feature in the 2024-2025 Hyaundai vehicles that can not be turned off. They were able to be turned off in previous models. Because of the over sensitivity of the feature it creates a distraction while driving. It triggers activation after 10 minutes of driving and goes off if you’re swerving or wearing sunglasses, etc. a number of reasons. However, while I have been driving perfectly fine, it continues to go off and beep every 5 or so minutes. No swerving. Both hands on wheel. The feature isn’t a bad idea but needs to be less sensitive and able to be turned off. Going off so consistently creates a distraction to me while driving. I could see there potentially being many lawsuits regarding this due to accidents. I have spoken to multiple Hyaundai dealerships and they all say there is nothing they can do. ",IVOQ,N,,N,N,N,,,,,,,,,,,,,,,,,,,,V,,N,N,,,A_multi_cmplid
2091541,11660630,Hyundai Motor America,HYUNDAI,SONATA,2024,N,20250421,N,0,0,FORWARD COLLISION AVOIDANCE: ADAPTIVE CRUISE CONTROL,Fairhope,AL,KMHL64JA6RA,20250513,20250513,,,"I have not had accident in vehicle. There is a driver attention warning feature in the 2024-2025 Hyaundai vehicles that can not be turned off. They were able to be turned off in previous models. Because of the over sensitivity of the feature it creates a distraction while driving. It triggers activation after 10 minutes of driving and goes off if you’re swerving or wearing sunglasses, etc. a number of reasons. However, while I have been driving perfectly fine, it continues to go off and beep every 5 or so minutes. No swerving. Both hands on wheel. The feature isn’t a bad idea but needs to be less sensitive and able to be turned off. Going off so consistently creates a distraction to me while driving. I could see there potentially being many lawsuits regarding this due to accidents. I have spoken to multiple Hyaundai dealerships and they all say there is nothing they can do. ",IVOQ,N,,N,N,N,,,,,,,,,,,,,,,,,,,,V,,N,N,,,A_multi_cmplid
2162040,11708117,Hyundai Motor America,HYUNDAI,SANTA FE,2026,N,20251231,N,0,0,FORWARD COLLISION AVOIDANCE: ADAPTIVE CRUISE CONTROL,Indianapolis,IN,5NMP3DGL3TH,20251231,20251231,,,I engaged the adaptive cruise control at 50 MPH. This enabled the driver attention system which I had turned off at the start of my drive. The driver attention system is unable to see my eyes through my prescription corrective lenses. This caused the Hyundai to throw multiple 'failure to control vehicle/failure to watch road' warnings over the course of a few seconds; culminating with the system trying to stop the car in heavy traffic. ,IVOQ,N,,N,N,N,,,,,,50,,,,,,,,,,,,,,V,,N,N,,,A_multi_cmplid
