2030807,11618678,"Kia America, Inc.",KIA,EV9,2024,N,20241008,N,0,0,ELECTRICAL SYSTEM:INSTRUMENT PANEL:SPEEDOMETER/ODOMETER:SENSOR/SENDING UNIT,Rochester ,MI,KNDAEFS51R6,20241008,20241008,,,"After starting and backing the car out of a parking spot, I noticed the instrument cluster display screen behind the steering wheel was completely blank, except for the letter of the gear I was in (P, R, or D) in the bottom center of the screen.  The symbol for the parking brake also appeared in the bottom left of the screen, and the Door Ajar symbol at the top of the screen.  The Heads Up display was also not working at all. When the turn signal was used, I could not see the light flash on the screen, and there was no audible noise telling me the turn signal was on.  In fact, many audio notifications did not work. I had no ability to see my speed as both the speedometer and Heads Up Display were not working.  I also could not see what mode of regenerative braking was being used, or any other vehicle status that normally appears on the status display. This is dangerous situation for multiple reasons:  1) I can not see how fast I was going 2) There were no safety indicators, visual or audio, that the seat belt is not used. 3) I can not tell if my turn signal was on, which could result in an accident when changing lanes if it wasn't working 4) I can not see how much range is left, potentially resulting in a situation where I get stranded. 5) I could not see what mode of regenerative braking I was in. This is important to ensure the car can be stopped in a safe manner, as each mode affects the stopping distance required. The problem can be reproduced.  I am unable to get the display cluster screen to reappear.  I have turned the car off and on and it still remains blank along with the heads up display.  I have also changed settings for the display cluster in the main menu, but it does not work.   I have not had an oppty to have this car inspected yet, but it is available upon request.  I plan to call Kia to schedule an appointment. There was also no warning this could occur.  I have not had an issue like this appear before.",IVOQ,N,,N,N,N,,,,,,,,,,,,,,,,,,,,V,,N,N,,,RANDOM
2068556,11644624,"Kia America, Inc.",KIA,EV6,2022,Y,20250222,N,0,0,UNKNOWN OR OTHER,Saint Augustine,FL,KNDC3DLCXN5,20250224,20250224,,,"On [XXX], I pulled into a parking space, and the car suddenly accelerated, jumped the curb, and hit the building.  This is the second time this happened.  It happened when I was parking in May 2022; the car suddenly accelerated and struck a fence.   In all my time driving this car, I have never had an issue breaking or parking.  There was an immediate surge in both cases, and I am confident that my foot was on the break.  In both cases, I did not get any collision warning from the car or emergency braking.  I know from experience driving this car that when the vehicle /system determined I was too close to something of danger, I would get a collision warning and an immediate breaking by the vehicle.  I reported the issue to the KIA dealership for the first time and wrote a report; they said they had not heard of the problem but would note it.  If there had been a person walking when this happened,  I am sure serious, if not fatal injuries would be occur.  INFORMATION REDACTED PURSUANT TO THE FREEDOM OF INFORMATION ACT (FOIA), 5 U.S.C. 552(B)(6)     ",IVOQ,N,,N,N,N,,,,,,0,,,,,,,,,,,,,,V,,N,N,,,RANDOM
1919847,11539110,Hyundai Motor America,HYUNDAI,TUCSON HYBRID,2022,N,20230816,N,0,0,VEHICLE SPEED CONTROL,Tamaqua,PA,KM8JECA1XNU,20230817,20230817,,,"The car shook and then lights and alarms went off indicating something went wrong with the hybrid system.  The car stopped accelerating, would shake, and then accelerated no more than 10 mph.  It was absolutely crazy!  Luckily, the highway that I was traveling on was not a busy one at the time because all I thought was this could have been a major accident if on a fast moving freeway.  I managed to pull over and started reading online about this issue occurring with other customers who purchased the same or similar vehicle.  So, I found a post and had shut the car off for 5 minutes, then restart and sit for 10 minutes, and then the car should work.  It did!  However, during the time of waiting I did reach out to the dealership and they said if the car is working there is nothing they could do.  So, I assumed it was safe to use travel to work for a meeting and set up my classroom for the start of the new school year.  On my way home from school, the issue happened again.  I immediately contacted the dealership and was able to get the car to them.  They started running diagnostic tests and currently have the vehicle on hand.  However, I don't really feel safe now with this car given the circumstances.  What if this should happen again? What if this happens to me or someone else who is traveling on a busy highway and it causes injury or even death to an accident.  The engine light came on, battery light flickered on and off, the car shook, the car's HEV system warning was going off, etc.   Please help and look into this matter. I do not have any documentation of repair as the car currently sits at the dealership, but I was so upset thinking about what could have happened and felt the need to report the issue. ",IVOQ,N,,N,N,N,,,,,,50,,,,,,,,,,,,,,V,,N,N,,,RANDOM
1796890,11453339,Hyundai Motor America,HYUNDAI,TUCSON,2016,N,20220207,N,0,0,UNKNOWN OR OTHER,Hamilton,NJ,KM8J3CA44GU,20220222,20220222,,,"The drivers side door almost never opens, I have to open the passenger side door to gain entry into the vehicle.  In addition, the drivers side window at times will not open.  I am not sure if this is an electrical problem.  On occasion, this also happens on the passenger side.  I do not want to be trapped in my car or have my passengers trapped.    Previously the drivers side back door would not open and the dealership replaced the latch.  At times I still have issues with the door opening from the inside and out, despite being unlocked. Rear driver side door does not open. It is not locked, child locks are not on. After reading multiple online forums it appears Hyundai is aware of the issue and not creating a Recall for this issue. The lock actuator needs to be replaced, Hyundai is charging outrageous fees to have this resolved. This is a HUGE safety issue. If the vehicle is in an accident any person sitting in the front drivers side, front passenger side and back seatsof the vehicle would not be able to get out of the vehicle on the rear driver side of the vehicle.   This is a huge safety concern if I were in an accident and could not open this door. I have seen DOZENS of other reports of people having this same issue and a recall should be issued immediately to fix this potential life threatening and dangerous issue.  ",IVOQ,N,,N,N,N,,,,,,,,,,,,,,,,,,,,V,,N,N,,,RANDOM
2136630,11691506,"Kia America, Inc.",KIA,SORENTO,2025,N,20250718,N,0,0,UNKNOWN OR OTHER,Springtown,TX,5XYRK4JF9SG,20251005,20251005,,,Transmission concern. Randomly rolls forward (about 1-2 feet) when placed in reverse. It rolls forward before it finally catches to reverse. I have rolled into and tapped another vehicle when exiting a parking spot. I have taken it to two different Dealers and they said basically it does that and I need to account for it. This car is a liability. ,IVOQ,N,,N,N,N,,,,,,,,,,,,,,,,,,,,V,,N,N,,,RANDOM
2205835,11737339,Hyundai Motor America,HYUNDAI,IONIQ HYBRID,2020,N,20260430,N,0,0,ELECTRICAL SYSTEM,Ft. Lauderdale,FL,KMHC75LC7LU,20260512,20260512,,,"While attempting a slow right turn from a complete stop at an intersection, I heard a loud thunk sound followed by an immediate loss of power steering response. The steering wheel spun freely with little resistance while the front tires did not respond proportionally. I was able to safely pull over. Upon restarting the vehicle it produced an abnormal wheezing sound suggesting additional mechanical stress. At the time of the failure the vehicle had approximately 40,000 miles, which I believe represents a premature failure for a safety-critical steering component.  The vehicle was brought to a Hyundai dealership for inspection. The dealer pulled diagnostic fault codes, found none, performed a 20-minute test drive, and returned the vehicle stating they could not find anything wrong. No physical inspection of the steering components was performed. The failure condition — a slow full-lock turn from a complete stop — was never specifically replicated during the dealer's test drive.  The problem has not been confirmed or repaired by the dealer. The vehicle is available for inspection. My safety and the safety of other drivers was put at risk by the sudden and unexpected loss of steering control. No warning lights appeared prior to or during the failure.",IVOQ,N,,N,N,N,,,,,,10,,,,,,,,,,,,,,V,,N,N,FL,,RANDOM
2175668,11717182,"Kia America, Inc.",KIA,EV6,2025,N,20251231,N,0,0,ELECTRICAL SYSTEM,Mc Kees Rocks,PA,5XYC3DJC8SG,20260211,20260211,,,"initial filed #11708370 (1/2/2026) 2nd filed #11717025 (2/10/26) Yesterday afternoon (2/10/26), I was told by Jim Shorkey Kia Wexford PA that no error codes are on the EV6, it is ready for pick up. Before I received this call, there was a software update done on the EV6 (see service records) I attached 2 photos of the software update as well.  ICCU ASSY was replaced, etc. was told per Shorkey Kia since there are no issues with my EV6, as of Friday when they initially called to say my vehicle was ready for pick up, Kia considers my problem resolved. I know I’ll be paying for the car rental for X number of days, even though the EV6 did not get the software update until this past Tuesday, yesterday 2/10/26, which cleared the 3 codes that were still showing on the Kia app earlier morning yesterday, screenshot of that attached as well. I have my car, no codes visible now. ",IVOQ,N,,N,N,N,,,,,,,,,,,,,,,,,,,,V,,N,N,,,RANDOM
1963663,11569352,Hyundai Motor America,HYUNDAI,PALISADE,2023,N,20231220,N,0,0,UNKNOWN OR OTHER,Hoover,AL,KM8R74GE7PU,20240201,20240201,,,I bought a 2023 hyundai palisade calligraphy and I found out the seat controls do not work and the air condition doesn’t work but they were fixed  but the most important thing is the BLUE LINK BUTTON WHERE THE REAR VIEW MIRROR IS  inside the car that I need in case of an emergency doesn’t work at all and doesn’t connect to hyundai blue link . I called hyundai manufacturer and I called hyundai blue link several times and their stupid engineers couldn’t fix the problem and I went to the dealership and their service dept and they couldn’t fix the issue . This is a brand new car that the blue link inside it doesn’t work at all and I paid for 3 years service .i push the blue link butto then it connects then it ends with no ring tone and no one on the other side . It keeps disconnecting and fails to connect me to blue link . This is a major defect in the hyundai palisade calligraphy and needs to be addressed seriously and professionally by hyundai and get it fixed immediately. I am attaching photos and videos and on my car screen it shown that blue link ended on 12/31/2023 but that is wrong because I have blue link until 1/26/2026 three more years but my car screen has it as expired on 12/31/2023 and that is wrong  ,IVOQ,N,,N,N,N,,,,,,,,,,,,,,,,,,,,V,,N,N,,,RANDOM
1890746,11519146,Hyundai Motor America,HYUNDAI,ACCENT,2017,N,20221101,N,0,0,ELECTRICAL SYSTEM:IGNITION:ANTI-THEFT:IMMOBILIZER/PROXIMITY:SENSOR,Minneapolis,MN,KMHCT5AE5HU,20230426,20230426,,,"Car got broken into and now has no wipers, bumper is falling off and mirror is cracked. Not happy that there wasn't a vehicle immobilized system in a car like this.",IVOQ,N,,N,N,N,,,,,,,,,,,,,,,,,,,,V,,N,N,,,RANDOM
2187065,11724812,Hyundai Motor America,HYUNDAI,SONATA,2016,N,20260314,N,0,0,UNKNOWN OR OTHER,Omaha,NE,5npe24af3gh,20260316,20260316,,,"code P1326 unable to accelerate, drive past 1st gear and knocking noise in engine area engine could stall out or lock up if problem is not fixed 3/14/2026- started engine light blinking warning light also  code p1326 has had recalls for this particular car brand",IVOQ,N,,N,N,N,,,,,,5,,,,,,,,,,,,,,V,,N,N,NE,,RANDOM
2184674,11723216,Hyundai Motor America,HYUNDAI,SANTA FE,2021,N,20260217,N,0,0,UNKNOWN OR OTHER,Cleveland,SC,5NMS2DAJ1MH,20260310,20260310,,,My horn stopped working. Not under warranty but I believe it is a safety issue. A replacement horn is not available and not under warranty. Online search revealed this is a common issue ,IVOQ,N,,N,N,N,,,,,,55,,,,,,,,,,,,,,V,,N,N,SC,,RANDOM
2052924,11633900,Hyundai Motor America,HYUNDAI,TUCSON,2019,N,20241216,N,0,0,ELECTRICAL SYSTEM,Wenatchee ,WA,KM8J33A42KU,20250103,20250103,,,The MDPS sensor is faulty and the electronic power steering shut down on my wife while she was driving on the highway.,IVOQ,N,,N,N,N,,,,,,60,,,,,,,,,,,,,,V,,N,N,,,RANDOM
2103483,11668936,Hyundai Motor America,HYUNDAI,IONIQ 5,2023,N,20250621,N,0,0,UNKNOWN OR OTHER,Palo Alto,CA,KM8KNDAF3PU,20250624,20250624,,,"I bought this ioniq 5 pre-owned at 10,000 miles on 6/21/25. Clean carfax and no active recalls. One mile off the lot the system I received the message ""12V battery voltage low. Stop safely."" The car completely turned off. Could not put it in neutral. I was stranded on the road and it could have caused an accident. I got it towed near an auto shop and bought a new battery, thinking it was just a dead 12V battery. The car turned on and seemed to resolved the issue, but after 20 minutes of driving, it completely turned off again on the road. Very dangerous. I dropped it off at Platinum Hyundai of Tracy dealership and am awaiting a diagnostic.",IVOQ,N,,N,N,N,,,,,,40,,,,,,,,,,,,,,V,,N,N,,,RANDOM
2195545,11730403,Hyundai Motor America,HYUNDAI,SANTA FE,2024,N,20240924,N,0,0,ELECTRICAL SYSTEM,Salado,TX,5NMP54GLXRH,20260410,20260410,,,"The digital screens that contain the gauge cluster and infotainment array intermittently flicker, black out, or go to static.  Sometimes it's one side or the other and sometimes it is both. When the gauge cluster screen is affected, the heads-up display on the windshield also turns off. All of this can happen while the vehicle is idle or while driving.  Sometimes the displays flicker and sometimes they just black out or go to static for the entirety of the drive. It is available for inspection.  The biggest safety concerns are the complete lack of a speedometer or warning lights when this problem occurs.  The problem did not have to be reproduced by the dealer because the screens and the HUD were completely blacked out when the vehicle was taken in for service.  The problem was supposedly ""repaired"" with an ""update"".  The problem has since resurfaced.  The vehicle was inspected by service center personnel at a Hyundai dealership.  When asked, a representative of that dealership stated that the problem is common amongst all Hyundai models featuring digital displays.  There was no warning of the problem.  One day the problem did not exist and the next it did.",IVOQ,N,,N,N,N,,,,,,,,,,,,,,,,,,,,V,,N,N,TX,,RANDOM
2150626,11700677,Hyundai Motor America,HYUNDAI,IONIQ 5,2023,N,20251001,N,0,0,LANE DEPARTURE: ASSIST,Frederick,MD,KM8KRDAF1PU,20251120,20251120,,,"Several times now the ""Check Driver Assistance System"" and ""Check Lane Assist System"" have come on and stayed on. I brought the car dealership, and they fixed it--but only temporarily--the problem recurs within a few days of the fix. All of the sensor cameras are clean. I have read that a weak 12-volt battery can cause this problem, but the car has only 28k miles on it, so the battery should not be weak yet. I will bring the car back to the dealer (again) and have them check the 12-volt battery strength.  But I am at the point where the ""check system"" messages are on more than they are working correctly.",IVOQ,N,,N,N,N,,,,,,,,,,,,,,,,,,,,V,,N,N,,,RANDOM
1922513,11540924,Hyundai Motor America,HYUNDAI,KONA,2021,N,20220505,N,0,0,ELECTRICAL SYSTEM,Darien,WI,KM8K5CA50MU,20230826,20230826,,,"When slowing down to a stop and im not completely stopped and then step on the gas the vehicle makes a winding noise and has no transmission engagement for several seconds so if im in s turning lane or even going forward when a street light turn green, there's been dozens of times where this happened and i need to let off the gas pedal slowing me down while e everyone else is gaining speed making them to jam on their breaks.  I let the dealership know and their answer was just come to a complete stop, i was like during a green light?   The other thing everyday I drive it the blind spot warning lights keep turning on even when theres no one around me and now i had the low tire pressure light turning on then off when the tires are completely inflated ",IVOQ,N,,N,N,N,,,,,,5,,,,,,,,,,,,,,V,,N,N,,,RANDOM
2160929,11707370,Hyundai Motor America,HYUNDAI,SANTA FE,2025,N,20251225,N,0,0,FORWARD COLLISION AVOIDANCE: ADAPTIVE CRUISE CONTROL,ALEXANDRIA,VA,5NMP2DGL5SH,20251228,20251228,,,"I am reporting a safety hazard with the Driver Monitoring/Driver Assistance system in my 2025 Hyundai Santa Fe SEL (VIN: [XXX] ). The system frequently misinterprets my normal driving behavior as inattentiveness and triggers constant, loud beeping while I am driving. In many cases, it also disables assistance functions mid‑drive, which is dangerous and unexpected.  The false alerts appear to be caused by the system misreading my eyes due to their natural shape and size. This issue does not occur with my wife, who has larger eyes, which indicates the system is biased toward certain physiologies and does not reliably detect all drivers. I have tested this repeatedly: if I strain my eyes unnaturally wide, the alerts stop, but this is extremely uncomfortable and only sustainable for a few seconds. The system is effectively pressuring the driver to adopt unsafe, unnatural behavior to avoid constant alarms.  Environmental conditions such as sun glare, rain, and darkness make the false alerts even more frequent. The sudden loud beeping is startling and forces me to divert attention from the road. The unexpected loss of assistance features during driving further increases the risk of an accident.  This system is not functioning as an assistive feature. Instead, it creates distraction, encourages unsafe compensatory behavior, and fails to accommodate normal variations in driver physiology. I request that NHTSA investigate whether Hyundai’s driver monitoring system meets safety and reliability standards and require corrective action if necessary. INFORMATION REDACTED PURSUANT TO THE FREEDOM OF INFORMATION ACT (FOIA), 5 U.S.C. 552(B)(6)",IVOQ,N,,N,N,N,,,,,,,,,,,,,,,,,,,,V,,N,N,,,RANDOM
2090441,11659881,Hyundai Motor America,HYUNDAI,PALISADE,2025,N,20250509,N,0,0,FORWARD COLLISION AVOIDANCE: WARNINGS,Chattanooga,TN,KM8R24GE8SU,20250509,20250509,,,"I was driving on a road that was very rough with many bumps and the car (well in front of me) began to slow down to avoid a big pot hole, I applied my brakes to slow down before I got close to that car. Because the road was rough, as many others have filed the same complaint now, my Palisade engaged the ABS and the car coasted much farther than it shoudl have with the amount of brake pressure I was applying to stop before I collided with the vehicle slowing in front of me. The ABS prevented me from stopping before I almost hit the car who at that point had stopped in front of me, the forward collision warning came on and the emergency braking applied violently which almost caused a wreck behind me as well becuase the person behind me was not prepared to me to come to a complete abrupt halt. The palisade stopped itself after the ABS wouldn't let me stop soon enough to avoid a collision in front of me - almost causing a wreck behind me. With a simple google search, this ABS engaging on rough roads is a major common problem that Hyundai needs to address before we're all paying for wrecks that we didn't cause due to driver neglience but rather the functionality of the vehicle is causing the safety problem. I immediately called my dealership and have an appt for them to look at it early next week. I'm frightened this will cause me or my wife and kids to be in a wreck that could have been prevented. ",IVOQ,N,,N,N,N,,,,,,35,,,,,,,,,,,,,,V,,N,N,,,RANDOM
2039389,11624601,Hyundai Motor America,HYUNDAI,SANTA FE,2024,N,20241108,N,0,0,ELECTRICAL SYSTEM,Wilmington,DE,5NMP2DGLXRH,20241111,20241111,,,"My vehicle was in for repairs at both a collision shop and a dealership following a minor accident. When I got the vehicle back, I found that the seat controls were not working, preventing me from moving the seat backward or forward. During a test drive, the car lost power despite the gas pedal being fully pressed; it wouldn't accelerate and then suddenly jerked forward. This could have caused an accident if I had been on a busy highway. Further testing revealed an abnormal noise at 1500 RPM in multiple gears. The vehicle has been towed back to the dealership, but there's no word yet on when it will be fixed. Hyundai has been contacted multiple times, as the car has been awaiting parts and undergoing repairs for over four months. They don't seem to be taking these safety issues seriously nor helpful in resolving the issue.",IVOQ,N,,N,N,N,,,,,,20,,,,,,,,,,,,,,V,,N,N,,,RANDOM
1806152,11459959,Hyundai Motor America,HYUNDAI,SONATA,2015,Y,20220406,N,0,0,FORWARD COLLISION AVOIDANCE: ADAPTIVE CRUISE CONTROL,Chesapeake,VA,5NPE34AF8FH,20220407,20220407,,,I had a safety recall on my car for the Smart Junction Box. I took the car to the dealership on March 9th 2022. They updated the software that controlls the Smart Juntion Box. On March 11th 2022 at 6:45am I got in a car accident due to the automatic braking system failure. I run into a Ford F-150 at the stop light. Even the brakes at this point failed to work properly as well. I called the deslership and explained what happened to me and I was told by the technician that there is a possibility that the update of the software that runs the Smart Junction Box has impacted the Smart Cruize Control. He said there is a possibility that the Smart Cruize Control settings have been erased to default so the car needed a new settings. That was something I did not know about. My car has the option where you can choose what distance you want between your car and the car in fromt of you. It goes from one-space car to four-space cars. So according to the technician this may has been the problem.,IVOQ,Y,,N,N,N,,,,,,,,,,,,,,,,,,,,V,,N,Y,,,RANDOM
2187646,11725199,Hyundai Motor America,HYUNDAI,PALISADE,2021,N,20260223,N,0,0,UNKNOWN OR OTHER,Tucson,AZ,KM8R54HE9MU,20260318,20260318,,,"The vehicle is experiencing a transmission failure that causes sudden jerking, hesitation, and loss of smooth acceleration when the engine reaches approximately 1,500–2,000 RPM. When driving under normal conditions on both city roads and highways, the transmission appears to slip or fail to properly engage or shift gears within this RPM range.  When this occurs, the vehicle jerks violently and momentarily loses power, creating a dangerous driving situation. This happens while accelerating in traffic and when attempting to maintain speed. The sudden hesitation and loss of proper transmission engagement creates a serious safety concern because the vehicle may not respond properly to acceleration, increasing the risk of a rear-end collision or crash, especially when merging onto highways or driving in traffic.  This issue occurs regularly and has become progressively worse over time, indicating a potential transmission defect rather than a one-time malfunction.  The problem was inspected and documented by Bill Luke Marana dealership in Tucson, Arizona. During their inspection, diagnostic data showed abnormal transmission input and output speed readings, confirming irregular transmission operation. The dealership marked the concern as requiring immediate attention.  There were no consistent warning lights prior to the failure, despite the severity of the symptoms. The vehicle and the dealership diagnostic documentation are available for inspection upon request.",IVOQ,N,,N,N,N,,,,,,,,,,,,,,,,,,,,V,,N,N,AZ,,RANDOM
1941597,11554104,"Kia America, Inc.",KIA,OPTIMA,2014,N,20231104,N,0,0,ELECTRICAL SYSTEM,Scranton,PA,5XXGN4A72EG,20231108,20231108,,,"I was with my family on PA I-476. While traveling home in our 2014 Kia Optima the vehicle’s dash lights such as oil lamp, battery, etc popped on. As soon as I noticed the lights the vehicle had completely lost all drivability. Lights operable and possibly radio and accessories but I had to react so quickly as it was so unexpected.   The vehicle completely lost its function and I was unable to operate it but in the capacity of steering and hardly able to break. Lost all power components.   We are so thankful I was able to make a split second decision to dodge traffic while vehicle was decelerating, 18 wheelers going by 70+ mph (speed limit) and pulled off to one of the few shoulders.   This scenario was so dangerous that if I didn’t believe in a higher being before, I do now!  Most the lanes are sandwiched by concrete barriers and there happened to be a coned off area I was able to decisively pull over to.   There was no warning this was happening. The vehicle was operating normally.   The engine compartment was smoking and all I could think was to get my family away from traffic.   The look on my wife and daughters face and the words my daughter asked me was life changing.    The vehicle is at Kia dealership since Saturday night. It’s Wednesday and they cannot provide diagnostic yet but are charging me for a starter already?  They began to inspect vehicle Monday.  ",IVOQ,N,,N,N,N,,,,,,70,,,,,,,,,,,,,,V,,N,N,,,RANDOM
